{
  "Title": "Flaxseeds for Sensitive Skin",
  "Url": "https://nutritionfacts.org/video/flaxseeds-for-sensitive-skin/",
  "YouTubeVideo": {
    "Url": "https://www.youtube.com/embed/5eKoUkLpE50"
  },
  "UpdatedAt": "2013-04-01T11:35:36+00:00",
  "Author": "Michael Greger M.D. FACLM",
  "Volume": {
    "Title": "Volume 12",
    "Url": "https://nutritionfacts.org/volumes/volume-12/"
  },
  "License": {
    "Name": "Creative Commons Attribution-NonCommercial 4.0 International (CC BY-NC 4.0)",
    "Url": "https://creativecommons.org/licenses/by-nc/4.0/"
  },
  "Description": "Instead of treating sensitive skin topically, with lotions and creams, why not treat it from the inside out—with diet?",
  "Transcript": "Below is an approximation of this video’s audio content. To see any graphs, charts, graphics, images, and quotes to which Dr. Greger may be referring, watch the above video.\nAbout half of the American population says they have sensitive skin, defined loosely as “tingling, chafing, burning,” itching sensations when exposed to various environmental factors. A similar high prevalence has been reported throughout Japan and Europe—especially in women.\nOften, there are no obvious signs, and, so, it’s often been dismissed by the medical community as a “princess and the pea” phenomenon—a mindset that has hindered the investigation of this problem.\nBut, now, it’s largely “recognized as a genuine phenomenon of physiological origin,” thought to arise from an “alteration of the skin barrier allowing potentially irritating substances to penetrate the skin and generate an inflammatory reaction.”\nOkay, so, what can we do about it? Well, recently, supplementation of flaxseed oil was found to diminish skin sensitivity and improve skin barrier function and condition.  In a randomized, double-blind, 12-week study, women were given about a half teaspoon of flaxseed oil a day—internally—versus safflower oil, as a control. That’s the amount of oil found in about a teaspoon and a half of flaxseeds.\nAfter three months, there was a significant decrease in skin reddening in the flax group compared to the safflower group, when an irritant chemical was painted on their forearms to measure skin sensitivity. Their skin also ended up significantly better hydrated, had significantly better barrier function—as evidenced by lower transepidermal water loss—skin that’s less rough; less scaly; and smoother. You can actually see the changes in a close-up view of the skin. Skin looked pretty much just as dry and scaly before and after the safflower oil intervention, but significantly improved after flaxseed oil.\nSensitive skin is typically treated by topical application of lotion and creams. But, why not treat it from the inside? “This study showed that daily supplementation with flaxseed oil improved skin appearance and led to a decreased skin sensitivity by improving epidermal barrier function and decreasing inflammation…”\nThe best source of flaxseed oil is within the flaxseed itself, right?  Then, you get all the nutrition of the whole food, and it’s cheaper and more stable. Unlike the oil, you can bake with the seeds without destroying the omega-3s, and can even store ground flaxseed for a month, at room temperature, without spoilage or oxidation.\nPlease consider volunteering to help out on the site.",
  "Sources": [
    {
      "Title": "Dayane de C. Morais, Érica A. Moraes. Heat Treatment and Thirty-Day Storage Period Do Not Affect the Stability of Omega-3 Fatty Acid in Brown Flaxseed (Linum Usitatissimum) Whole Flour. Food and Nutrition Sciences, 2011, 2, 281-286 2011 2(NA):281-286",
      "Url": "http://www.scirp.org/fileOperation/downLoad.aspx?path=FNS20110400005_42622933.pdf&type=journal"
    },
    {
      "Title": "K. Neukam, S. De Spirt, W. Stahl, M. Bejot, J.-M. Maurette, H. Tronnier, U. Heinrich. Supplementation of flaxseed oil diminishes skin sensitivity and improves skin barrier function and condition. Skin Pharmacol Physiol 2011 24(2):67 - 74",
      "Url": "http://www.ncbi.nlm.nih.gov/pubmed/21088453"
    },
    {
      "Title": "L. Misery, V. Sibaud, C. Merial-Kieny, C. Taieb. Sensitive skin in the American population: Prevalence, clinical data, and role of the dermatologist. Int. J. Dermatol. 2011 50(8):961 - 967",
      "Url": "http://www.ncbi.nlm.nih.gov/pubmed/21781068"
    },
    {
      "Title": "M. A. Farage, H. I. Maibach. Sensitive skin: Closing in on a physiological cause. Contact Derm. 2010 62(3):137 - 149",
      "Url": "http://www.ncbi.nlm.nih.gov/pubmed/20565500"
    }
  ],
  "Acknowledgements": "Images thanks to stevendepolo via flickr",
  "Topics": [
    {
      "Title": "Europe",
      "Url": "https://nutritionfacts.org/topics/europe/"
    },
    {
      "Title": "flaxseeds",
      "Url": "https://nutritionfacts.org/topics/flax-seeds/"
    },
    {
      "Title": "inflammation",
      "Url": "https://nutritionfacts.org/topics/inflammation/"
    },
    {
      "Title": "Japan",
      "Url": "https://nutritionfacts.org/topics/japan/"
    },
    {
      "Title": "omega-3 fatty acids",
      "Url": "https://nutritionfacts.org/topics/omega-3-fatty-acids/"
    },
    {
      "Title": "safflower oil",
      "Url": "https://nutritionfacts.org/topics/safflower-oil/"
    },
    {
      "Title": "seeds",
      "Url": "https://nutritionfacts.org/topics/seeds/"
    },
    {
      "Title": "skin health",
      "Url": "https://nutritionfacts.org/topics/skin-health/"
    },
    {
      "Title": "women's health",
      "Url": "https://nutritionfacts.org/topics/womens-health/"
    }
  ],
  "DoctorsNote": {
    "Html": "<p>I bet one of the reasons the medical community was so dismissive is because of the preponderance of sensitive skin in women. Did you see my video about how the profession used to treat menopause? Ghastly: <a title=\"Permanent link to Plant-Based Bioidentical Hormones\" href=\"https://nutritionfacts.org/video/plant-based-bioidentical-hormones/\">Plant-Based Bioidentical Hormones</a>.</p>\n<p>For more on eating your way towards healthier skin, see:</p>\n<ul>\n<li><a title=\"Permanent link to Rosy Glow\" href=\"https://nutritionfacts.org/video/rosy-glow/\">Rosy Glow</a></li>\n<li><a title=\"Permanent link to Golden Glow\" href=\"https://nutritionfacts.org/video/golden-glow/\">Golden Glow</a></li>\n<li><a title=\"Permanent link to Skim Milk and Acne\" href=\"https://nutritionfacts.org/video/skim-milk-and-acne/\">Skim Milk and Acne</a></li>\n<li><a title=\"Permanent link to Preventing Wrinkles with Diet\" href=\"https://nutritionfacts.org/video/preventing-wrinkles-with-diet/\">Preventing Wrinkles with Diet</a></li>\n<li><a title=\"Permanent link to Beauty Is More Than Skin Deep\" href=\"https://nutritionfacts.org/video/beauty-is-more-than-skin-deep/\">Beauty Is More Than Skin Deep</a></li>\n<li><a title=\"Permanent link to Produce, Not Pills to Increase Physical Attractiveness\" href=\"https://nutritionfacts.org/video/produce-not-pills-to-increase-physical-attractiveness/\">Produce, Not Pills to Increase Physical Attractiveness</a></li>\n</ul>\n<p>For more on flax, see my last three videos: <a href=\"https://nutritionfacts.org/video/flaxseed-vs-prostate-cancer/\">Flax Seeds vs. Prostate Cancer</a>; <a href=\"https://nutritionfacts.org/video/was-it-the-flaxseed-fat-restriction-or-both/\">Was It the Flax Seed, Fat Restriction, or Both?</a>; and <a href=\"https://nutritionfacts.org/video/flaxseed-vs-diabetes/\">Flax Seed vs. Diabetes</a>. Sick of flax videos already? No problem! Stay tuned for my next video, <a href=\"https://nutritionfacts.org/video/fiber-vs-breast-cancer/\">Fiber vs. Breast Cancer</a>.</p>\n<p>For further context, also check out my associated blog posts: <a href=\"https://nutritionfacts.org/2013/10/10/flaxseeds-for-sensitive-skin/\">Treating Sensitive Skin From the Inside Out</a>; <a href=\"https://nutritionfacts.org/2013/10/15/flaxseeds-for-breast-cancer-prevention/\">Flax and Breast Cancer Prevention</a>; and <a href=\"https://nutritionfacts.org/2013/10/17/flaxseeds-breast-cancer-survival/\">Flax and Breast Cancer Survival</a>.</p>\n     <p>If you haven&#39;t yet, you can <a href=\"https://nutritionfacts.org/subscribe/\" title=\"Subscribe\">subscribe to our free newsletter</a>. With your subscription, you&#39;ll also get notifications for just-released blogs and videos. Check out our <a href=\"https://nutritionfacts.org/translations-info/\" target=\"_blank\" title=\"Translated Resources\">information page</a> about our translated resources.</p>"
  }
}
