{
  "Title": "Cattlemen’s Association Has Beef with Study",
  "Url": "https://nutritionfacts.org/video/cattlemens-association-has-beef-with-epic-study/",
  "YouTubeVideo": {
    "Url": "https://www.youtube.com/embed/F7wQdOhU7ac"
  },
  "UpdatedAt": "2012-09-05T11:11:44+00:00",
  "Author": "Michael Greger M.D. FACLM",
  "Volume": {
    "Title": "Volume 10",
    "Url": "https://nutritionfacts.org/volumes/volume-10/"
  },
  "License": {
    "Name": "Creative Commons Attribution-NonCommercial 4.0 International (CC BY-NC 4.0)",
    "Url": "https://creativecommons.org/licenses/by-nc/4.0/"
  },
  "Description": "Meat consumption is not only associated with weight gain, but specifically abdominal obesity, which is the most metabolically concerning.",
  "Transcript": "The National Cattlemen’s Beef Association was not happy about the findings of the EPIC study, one of the largest studies on human nutrition ever performed—which, as we’ve seen recently, found that those who eat any kind of meat go on to gain significantly more weight than those who eat less—even eating the same number of calories.\nOne of the beef association’s speakers wrote to the American Journal of Clinical Nutrition, complaining that “Meat intake’s influence on body fatness cannot be assessed without measurement of body fat.” Maybe, the cattlemen argued, the pounds that the meateaters packed on was muscle mass, not fat. Maybe they were becoming beefier, not fatter.\nFine, the researcher answered. We’ll not just measure obesity, but abdominal obesity—the worst kind. So, they took a small sample out of the study, a sample of 91,214 people, and found the exact same thing. Even eating the same number of calories, the more meat we eat, the more our belly grows. And even calculated how much our waistline could be predicted to expand, based on our daily meat consumption. So, one can plan ahead for the new pants one might need to buy.\nThough nothing comes close to the EPIC study in scale, other recent studies have found the same thing. In Spain, nut and vegetable consumption was recently associated with having a slimmer waist, and meat and meat product consumption with a wider one. Another new study, this one out of Belgium, concluded that animal protein intake was associated with bigger body mass index and waistline, whereas plant protein intake was associated with a smaller BMI and slimmer waist—indicating that the intakes of plant protein could offer a potential protective effect against overweight and obesity.\nTo see any graphs, charts, graphics, images, and quotes to which Dr. Greger may be referring watch the above video. This is just an approximation of the audio contributed by Kerry Skinner.\nPlease consider volunteering to help out on the site.",
  "Sources": [
    {
      "Title": "Astrup A, Clifton P, Layman DK, Mattes RD, Westerterp-Plantenga MS. Meat intake's influence on body fatness cannot be assessed without measurement of body fat. Am J Clin Nutr. 2010 Nov;92(5):1274-5; author reply 1275-6.",
      "Url": "http://www.ajcn.org/content/92/5/1274.full.pdf+html"
    },
    {
      "Title": "Casas-Agustench P, Bulló M, Ros E, Basora J, Salas-Salvadó J; Nureta-PREDIMED investigators. Cross-sectional association of nut intake with adiposity in a Mediterranean population. Nutr Metab Cardiovasc Dis. 2011 Jul;21(7):518-25.",
      "Url": "http://www.ncbi.nlm.nih.gov/pubmed/20219336"
    },
    {
      "Title": "Lin Y, Bolca S, Vandevijvere S, De Vriese S, Mouratidou T, De Neve M, Polet A, Van Oyen H, Van Camp J, De Backer G, De Henauw S, Huybrechts I. Plant and animal protein intake and its association with overweight and obesity among the Belgian population. Br J Nutr. 2011 Apr;105(7):1106-16.",
      "Url": "http://www.ncbi.nlm.nih.gov/pubmed/21144092"
    },
    {
      "Title": "Vergnaud AC, Norat T, Romaguera D, Mouw T, May AM, Travier N, Luan J, Wareham N, Slimani N, Rinaldi S, Couto E, Clavel-Chapelon F, Boutron-Ruault MC, Cottet V, Palli D, Agnoli C, Panico S, Tumino R, Vineis P, Agudo A, Rodriguez L, Sanchez MJ, Amiano P, Barricarte A, Huerta JM, Key TJ, Spencer EA, Bueno-de-Mesquita B, Büchner FL, Orfanos P, Naska A, Trichopoulou A, Rohrmann S, Hermann S, Boeing H, Buijsse B, Johansson I, Hellstrom V, Manjer J, Wirfält E, Jakobsen MU, Overvad K, Tjonneland A, Halkjaer J, Lund E, Braaten T, Engeset D, Odysseos A, Riboli E, Peeters PH. Meat consumption and prospective weight change in participants of the EPIC-PANACEA study. Am J Clin Nutr. 2010 Aug;92(2):398-407.",
      "Url": "http://www.ncbi.nlm.nih.gov/pubmed/20592131"
    }
  ],
  "Acknowledgements": "",
  "Topics": [
    {
      "Title": "abdominal fat",
      "Url": "https://nutritionfacts.org/topics/abdominal-fat/"
    },
    {
      "Title": "animal fat",
      "Url": "https://nutritionfacts.org/topics/animal-fat/"
    },
    {
      "Title": "animal products",
      "Url": "https://nutritionfacts.org/topics/animal-products/"
    },
    {
      "Title": "animal protein",
      "Url": "https://nutritionfacts.org/topics/animal-protein/"
    },
    {
      "Title": "body fat",
      "Url": "https://nutritionfacts.org/topics/body-fat/"
    },
    {
      "Title": "calories",
      "Url": "https://nutritionfacts.org/topics/calories/"
    },
    {
      "Title": "EPIC Study",
      "Url": "https://nutritionfacts.org/topics/epic-study/"
    },
    {
      "Title": "fat",
      "Url": "https://nutritionfacts.org/topics/fat/"
    },
    {
      "Title": "industry influence",
      "Url": "https://nutritionfacts.org/topics/industry-influence/"
    },
    {
      "Title": "meat",
      "Url": "https://nutritionfacts.org/topics/meat/"
    },
    {
      "Title": "nuts",
      "Url": "https://nutritionfacts.org/topics/nuts/"
    },
    {
      "Title": "obesity",
      "Url": "https://nutritionfacts.org/topics/obesity/"
    },
    {
      "Title": "plant protein",
      "Url": "https://nutritionfacts.org/topics/plant-protein/"
    },
    {
      "Title": "protein",
      "Url": "https://nutritionfacts.org/topics/protein/"
    },
    {
      "Title": "vegetables",
      "Url": "https://nutritionfacts.org/topics/vegetables/"
    },
    {
      "Title": "weight loss",
      "Url": "https://nutritionfacts.org/topics/weight-loss/"
    }
  ],
  "DoctorsNote": {
    "Html": "<p>The findings of the EPIC study linking meat consumption to weight gain can be found in <a href=\"https://nutritionfacts.org/video/meat-and-weight-gain-in-the-panacea-study/\" rel=\"nofollow\">Meat and Weight Gain in the PANACEA Study</a>. The Cattlemen were also vocal in questioning the federal dietary guidelines; see <a href=\"https://nutritionfacts.org/video/dietary-guidelines-corporate-guidance/\" rel=\"nofollow\">Dietary Guidelines: Corporate Guidance</a>. Tomorrow, we’ll cover the various ways excess body fat can be measured.</p>\n<p>For more context, check out my associated blog posts <a href=\"https://nutritionfacts.org/blog/poultry-paunch-meat-weight-gain/\">Poultry Paunch: Meat &amp; Weight Gain</a>; <a href=\"https://nutritionfacts.org/2013/10/24/can-cellulite-be-treated-with-diet/\">Diet and Cellulite</a>; and <a href=\"https://nutritionfacts.org/2013/07/30/is-coconut-oil-good-for-you/\">Is Coconut Oil Bad For You?</a></p>\n     <p>If you haven&#39;t yet, you can <a href=\"https://nutritionfacts.org/subscribe/\" title=\"Subscribe\">subscribe to our free newsletter</a>. With your subscription, you&#39;ll also get notifications for just-released blogs and videos. Check out our <a href=\"https://nutritionfacts.org/translations-info/\" target=\"_blank\" title=\"Translated Resources\">information page</a> about our translated resources.</p>"
  }
}
