{
  "Title": "Nonhuman Molecules Lining our Arteries",
  "Url": "https://nutritionfacts.org/video/nonhuman-molecules-lining-our-arteries/",
  "YouTubeVideo": {
    "Url": "https://www.youtube.com/embed/hy5BPWnaFik"
  },
  "UpdatedAt": "2012-12-17T12:40:38+00:00",
  "Author": "Michael Greger M.D. FACLM",
  "Volume": {
    "Title": "Volume 11",
    "Url": "https://nutritionfacts.org/volumes/volume-11/"
  },
  "License": {
    "Name": "Creative Commons Attribution-NonCommercial 4.0 International (CC BY-NC 4.0)",
    "Url": "https://creativecommons.org/licenses/by-nc/4.0/"
  },
  "Description": "The foreign meat molecule Neu5Gc builds up in human tumors and atherosclerotic plaques, and may play an inflammatory role in the progression of both diseases.",
  "Transcript": "Below is an approximation of this video’s audio content. To see any graphs, charts, graphics, images, and quotes to which Dr. Greger may be referring, watch the above video.\nThe foreign meat molecule Neu5Gc tends to accumulate, particularly in the lining of hollow organs—where carcinomas, like breast cancer, develop inside your glands, and in the lining blood of vessels, where atherosclerosis occurs.\n“Evidence for a novel human-specific xeno-auto-antibody response against vascular endothelium.”\n“The Neu5Gc accumulation may facilitate production of anti-Neu5Gc antibodies and further aggravate chronic inflammation in atherosclerosis progression”—in addition to just cancer.\nHere, you can see it, stained in red, lining the aorta of a human autopsy sample. And here, you can actually see it inside atherosclerotic plaques, providing multiple pathways for accelerating inflammation in this disease.\nRemember, we lost the ability to make this substance millions of years ago. Whether it’s feeding inflammation to our cancer, or to our heart disease, it all came from the animal products in our diet.\n“Taken together, these findings suggest a mechanism whereby anti-Neu5Gc antibodies can initiate, perpetuate, and/or exacerbate an inflammatory response at the endothelium [the lining of our arteries], potentially playing a role in disease states such as atherosclerosis, [where] vascular inflammation is involved. Neu5Gc is a novel dietary and human- specific ‘xeno-auto-antigen’ that may exacerbate a variety of vascular pathologies.”\nThey go onto note that if we actually ate what the USDA recommends for protein, in the form of meat and dairy, we could ingest as much 10 milligrams of Neu5Gc per day, which is 10 milligrams more than we evolved to have in our bodies since, as a species, we stopped making it millions of years ago, before we started eating meat.\n“…[N]ovel therapeutic approaches to reducing or dampening flares of immunologic responses against the endothelium…could include reduction of dietary Neu5Gc intake and accumulation through simple diet-based interventions.”\nNot so novel, perhaps, but definitely simple. This inflammatory cancer promoter “has never been reported in plants.”\nPlease consider volunteering to help out on the site.",
  "Sources": [
    {
      "Title": "Hedlund M, Padler-Karavani V, Varki NM, Varki A. Evidence for a human-specific mechanism for diet and antibody-mediated inflammation in carcinoma progression. Proc Natl Acad Sci U S A. 2008 Dec 2;105(48):18936-41.",
      "Url": "http://www.pnas.org/content/105/48/18936.full.pdf+html"
    },
    {
      "Title": "Pham T, Gregg CJ, Karp F, Chow R, Padler-Karavani V, Cao H, Chen X, Witztum JL, Varki NM, Varki A. Evidence for a novel human-specific xeno-auto-antibody response against vascular endothelium. Blood. 2009 Dec 10;114(25):5225-35.",
      "Url": "http://bloodjournal.hematologylibrary.org/content/114/25/5225.full.pdf+html"
    },
    {
      "Title": "Varki A. Colloquium paper: uniquely human evolution of sialic acid genetics and biology. Proc Natl Acad Sci U S A. 2010 May 11;107 Suppl 2:8939-46.",
      "Url": "http://www.ncbi.nlm.nih.gov/pmc/articles/PMC3024026/pdf/pnas.200914634.pdf"
    }
  ],
  "Acknowledgements": "",
  "Topics": [
    {
      "Title": "animal products",
      "Url": "https://nutritionfacts.org/topics/animal-products/"
    },
    {
      "Title": "animal protein",
      "Url": "https://nutritionfacts.org/topics/animal-protein/"
    },
    {
      "Title": "breast cancer",
      "Url": "https://nutritionfacts.org/topics/breast-cancer/"
    },
    {
      "Title": "cancer",
      "Url": "https://nutritionfacts.org/topics/cancer/"
    },
    {
      "Title": "cardiovascular disease",
      "Url": "https://nutritionfacts.org/topics/cardiovascular-disease/"
    },
    {
      "Title": "dairy",
      "Url": "https://nutritionfacts.org/topics/dairy/"
    },
    {
      "Title": "heart disease",
      "Url": "https://nutritionfacts.org/topics/heart-disease/"
    },
    {
      "Title": "inflammation",
      "Url": "https://nutritionfacts.org/topics/inflammation/"
    },
    {
      "Title": "meat",
      "Url": "https://nutritionfacts.org/topics/meat/"
    },
    {
      "Title": "Neu5Gc",
      "Url": "https://nutritionfacts.org/topics/neu5gc/"
    },
    {
      "Title": "plant protein",
      "Url": "https://nutritionfacts.org/topics/plant-protein/"
    },
    {
      "Title": "Plant-Based Diets",
      "Url": "https://nutritionfacts.org/topics/plant-based-diets/"
    },
    {
      "Title": "protein",
      "Url": "https://nutritionfacts.org/topics/protein/"
    },
    {
      "Title": "USDA",
      "Url": "https://nutritionfacts.org/topics/usda/"
    },
    {
      "Title": "vegans",
      "Url": "https://nutritionfacts.org/topics/vegans/"
    },
    {
      "Title": "vegetable protein",
      "Url": "https://nutritionfacts.org/topics/vegetable-protein/"
    },
    {
      "Title": "vegetarians",
      "Url": "https://nutritionfacts.org/topics/vegetarians/"
    },
    {
      "Title": "women's health",
      "Url": "https://nutritionfacts.org/topics/womens-health/"
    }
  ],
  "DoctorsNote": {
    "Html": "<p>See <a href=\"https://nutritionfacts.org/video/the-inflammatory-meat-molecule-neu5gc/\">The Inflammatory Meat Molecule Neu5Gc</a> for background, and <a href=\"https://nutritionfacts.org/video/how-tumors-use-meat-to-grow-xeno-autoantibodies/\">How Tumors Use Meat to Grow: Xeno-Autoantibodies</a> for the role it might play in cancer growth. Inflammation is also caused by exogenous endotoxins (see <a href=\"https://nutritionfacts.org/video/the-exogenous-endotoxin-theory/\">The Exogenous Endotoxin Theory</a>), and is one of the three steps en route to fatal heart disease; see <a href=\"https://nutritionfacts.org/video/arterial-acne/\">Arterial Acne</a>; <a href=\"https://nutritionfacts.org/video/blocking-the-first-step-of-heart-disease/\">Blocking the First Step of Heart Disease</a>; and <a href=\"https://nutritionfacts.org/video/making-our-arteries-less-sticky/\">Making Our Arteries Less Sticky</a>. Antioxidants found predominantly in plants (see <a href=\"https://nutritionfacts.org/video/antioxidant-power-of-plant-foods-versus-animal-foods/\">Antioxidant Power of Plant Foods Versus Animal Foods</a>) may also decrease inflammation within the body (see <a href=\"https://nutritionfacts.org/video/anti-inflammatory-antioxidants/\">Anti-Inflammatory Antioxidants</a>). Nuts may be particularly useful in this regard; see <a href=\"https://nutritionfacts.org/video/fighting-inflammation-in-a-nut-shell/\">Fighting Inflammation in a Nut Shell.</a> Tomorrow, we’ll close out the Neu5Gc story with <a href=\"https://nutritionfacts.org/video/meat-may-exceed-daily-allowance-of-irony/\">Meat May Exceed Daily Allowance of Irony</a>.</p>\n<p>For further context, check out my associated blog post: <a href=\"https://nutritionfacts.org/2013/05/16/plant-based-diets-for-rheumatoid-arthritis/\">Plant-Based Diets for Rheumatoid Arthritis</a>.</p>\n     <p>If you haven&#39;t yet, you can <a href=\"https://nutritionfacts.org/subscribe/\" title=\"Subscribe\">subscribe to our free newsletter</a>. With your subscription, you&#39;ll also get notifications for just-released blogs and videos. Check out our <a href=\"https://nutritionfacts.org/translations-info/\" target=\"_blank\" title=\"Translated Resources\">information page</a> about our translated resources.</p>"
  }
}
