{
  "Title": "Skim Milk and Acne",
  "Url": "https://nutritionfacts.org/video/skim-milk-and-acne/",
  "YouTubeVideo": {
    "Url": "https://www.youtube.com/embed/guniBUojHAM"
  },
  "UpdatedAt": "2012-05-11T12:00:21+00:00",
  "Author": "Michael Greger M.D. FACLM",
  "Volume": {
    "Title": "Volume 8",
    "Url": "https://nutritionfacts.org/volumes/volume-8/"
  },
  "License": {
    "Name": "Creative Commons Attribution-NonCommercial 4.0 International (CC BY-NC 4.0)",
    "Url": "https://creativecommons.org/licenses/by-nc/4.0/"
  },
  "Description": "Three Harvard studies linking acne with dairy consumption in adolescent girls and boys blamed the sex steroid hormone content naturally found in cow’s milk (even without added hormones)—particularly skim.",
  "Transcript": "The Harvard Nurses’ Study, published in the prestigious Journal of the American Academy of Dermatology, funded in part by none other than the National Dairy Council itself, found that the association between milk intake during adolescence and severe physician-diagnosed teenage acne was even more marked for skim milk than for other forms of milk.\nThis may be because there is so much more estrogen in skim milk. Researchers found 15 steroid sex hormones in commercial milk right off the shelves, and the highest levels were found in skim milk, compared to 2% and whole.\nThis study involved asking women what they ate years ago in high school, though. Who can even remember?\nSo, the next year, Harvard researchers studied milk consumption and acne in adolescent girls directly, following 6,000 girls, aged 9-15, for a few years, and found the same thing: a positive link between intake of milk and acne. Maybe it’s just girls, though?\nSo, next, they studied milk consumption and acne in teenage boys, and here we go again: a positive association between intake of skim milk and acne.\nAnd it doesn’t appear to be an issue with bovine growth hormone injections, or added steroids. This is just what milk contains naturally. It should surprise no one that milk contains such a heavy complement of growth-enhancing hormones. Milk is, after all, specifically designed to make things grow.\nTo see any graphs, charts, graphics, images, and quotes to which Dr. Greger may be referring, watch the above video. This is just an approximation of the audio contributed by veganmontreal. \nPlease consider volunteering to help out on the site.",
  "Sources": [
    {
      "Title": "Adebamowo CA, Spiegelman D, Berkey CS, Danby FW, Rockett HH, Colditz GA, Willett WC, Holmes MD. Milk consumption and acne in adolescent girls. Dermatol Online J. 2006 May 30;12(4):1.",
      "Url": "http://www.ncbi.nlm.nih.gov/pubmed/17083856"
    },
    {
      "Title": "Adebamowo CA, Spiegelman D, Danby FW, Frazier AL, Willett WC, Holmes MD. High school dietary dairy intake and teenage acne. J Am Acad Dermatol. 2005 Feb;52(2):207-14.",
      "Url": "http://www.ncbi.nlm.nih.gov/pubmed/15692464"
    },
    {
      "Title": "Danby FW. Acne and milk, the diet myth, and beyond. J Am Acad Dermatol. 2005 Feb;52(2):360-2.",
      "Url": "http://www.ncbi.nlm.nih.gov/pubmed/15692488"
    }
  ],
  "Acknowledgements": "",
  "Topics": [
    {
      "Title": "acne",
      "Url": "https://nutritionfacts.org/topics/acne/"
    },
    {
      "Title": "adolescence",
      "Url": "https://nutritionfacts.org/topics/adolescence/"
    },
    {
      "Title": "dairy",
      "Url": "https://nutritionfacts.org/topics/dairy/"
    },
    {
      "Title": "estrogen",
      "Url": "https://nutritionfacts.org/topics/estrogen/"
    },
    {
      "Title": "Harvard",
      "Url": "https://nutritionfacts.org/topics/harvard/"
    },
    {
      "Title": "Harvard Nurses' Health Study",
      "Url": "https://nutritionfacts.org/topics/harvard-nurses-health-study/"
    },
    {
      "Title": "hormones",
      "Url": "https://nutritionfacts.org/topics/hormones/"
    },
    {
      "Title": "milk",
      "Url": "https://nutritionfacts.org/topics/milk/"
    },
    {
      "Title": "skim milk",
      "Url": "https://nutritionfacts.org/topics/skim-milk/"
    },
    {
      "Title": "skin health",
      "Url": "https://nutritionfacts.org/topics/skin-health/"
    }
  ],
  "DoctorsNote": {
    "Html": "<p>Be sure to see <a href=\"https://nutritionfacts.org/video/national-dairy-council-on-acne-and-milk/\" rel=\"nofollow\">National Dairy Council on Acne and Milk</a> and <a href=\"https://nutritionfacts.org/video/the-acne-promoting-effects-of-milk/\">The Acne-Promoting Effects of Milk</a> in this three-part video series on the latest science on milk as a risk factor for acne development.</p>\n<p>For further context, check out my associated blog posts: <a href=\"https://nutritionfacts.org/blog/skim-milk-and-acne/\">Skim Milk and Acne</a>; <a href=\"https://nutritionfacts.org/2012/05/03/stool-size-and-breast-cancer-risk/\" rel=\"nofollow\">Stool Size and Breast Cancer Risk</a>; and <a href=\"https://nutritionfacts.org/2013/10/10/flaxseeds-for-sensitive-skin/\">Treating Sensitive Skin From the Inside Out</a>.</p>\n     <p>If you haven&#39;t yet, you can <a href=\"https://nutritionfacts.org/subscribe/\" title=\"Subscribe\">subscribe to our free newsletter</a>. With your subscription, you&#39;ll also get notifications for just-released blogs and videos. Check out our <a href=\"https://nutritionfacts.org/translations-info/\" target=\"_blank\" title=\"Translated Resources\">information page</a> about our translated resources.</p>"
  }
}
