{
  "Title": "Why Don’t Health Insurers Encourage Healthier Eating?",
  "Url": "https://nutritionfacts.org/video/why-dont-health-insurers-encourage-healthier-eating/",
  "YouTubeVideo": {
    "Url": "https://youtube.com/v/HsOdTyIT0GY"
  },
  "UpdatedAt": "2022-08-03T11:50:29+00:00",
  "Author": "Michael Greger M.D. FACLM",
  "Volume": {
    "Title": "Volume 58",
    "Url": "https://nutritionfacts.org/volumes/volume-58/"
  },
  "License": {
    "Name": "Creative Commons Attribution-NonCommercial 4.0 International (CC BY-NC 4.0)",
    "Url": "https://creativecommons.org/licenses/by-nc/4.0/"
  },
  "Description": "Why don’t more big payors in health care embrace plant-based eating?",
  "Transcript": "Below is an approximation of this video’s audio content. To see any graphs, charts, graphics, images, and quotes to which Dr. Greger may be referring, watch the above video.\nMany of the diseases that cause a constant drain on health care budgets can be prevented by proper nutrition; so, why aren’t the big payors getting involved? I mean even like a 1 percent decline in excess body fat could alone save tens of billions. You’d think at least the health insurance industry would try to get people to eat healthier to try to pay out less money. Well, one could say the insurance industry actually benefits from high healthcare costs because these rising costs are simply passed on to both individuals and employers in terms of higher premiums, and insurers take a fixed percentage of these premiums as increasing profits. They get a piece of the pie; so, the bigger the pie—the unhealthier everyone is—the bigger their piece. As such, insurers have not done as much as they could to help reduce health care costs because lower costs would hurt their bottom line.\n“What if there was a medication that could successfully treat and even reverse heart disease, type 2 diabetes, high blood pressure, and many other chronic conditions without any negative side effects and offered the promise of dramatically reduced health care costs?” Imagine all the advertising there would be to promote it; imagine how much they would charge. A drug that could not just treat but cure diabetes and these other diseases? “Then, what if you were told this medication exists today, is available to everyone in unlimited quantities at a low cost, but the vast majority of the American public has never heard about it.” Do you want a solution to significantly reduce health care costs? The solution is to use food as medical treatment, specifically, foods made from minimally processed plants.\n“One of the main barriers is simply the current widespread belief that once someone has a chronic condition, such as heart disease or type 2 diabetes, there is very little that can be done to actually reverse the disease, and the best outcome possible is to maintain the condition so that it just doesn’t get any worse. The fact that a whole food plant-based approach provides a safe, effective, low-cost alternative to not just eliminating symptoms but potentially reversing the underlying condition without drugs or surgery is unknown to a vast majority of Americans. In contrast to the pharmaceutical industry that spends large sums to market new drugs,…there are not big profits in promoting a plant-based diet.”\nThe politics surrounding healthcare is who’s-going-to-pay-for-it, instead of what kind of healthcare is best, and the evidence is overwhelming that a whole food, plant-based diet provides the best opportunity to not only reduce the growth in spending, but actually decrease total health care costs more than any drug, medical procedure, insurance reform, or provider payment model out there.\nThankfully, the word is spreading. A review of the evidence published in Kaiser Permanente’s journal concluded that “[p]hysicians should consider recommending a plant-based diet to all their patients, especially those with high blood pressure, diabetes, cardiovascular disease, or obesity. Kaiser has followed up with user friendly guides (freely available online) for both physicians and patients, explaining the benefits and practical aspects of implementing a plant-based diet.” So hey, why aren’t all insurers sending out such information to all their members? You know how all the drug ads are, like, “Ask your doctor if this drug is right for you.” Well, members could be prompted to ask their physicians about the ability of a plant-based diet to reduce or eliminate prescription drug use and reverse disease. Though of course, these materials would also have to list all the side effects. Side effects include: “increased energy, lower blood pressure, improved digestion, all while eating unlimited quantities of satisfying food.” Ask your doctor if plants are right for you.\nPlease consider volunteering to help out on the site.",
  "Sources": [
    {
      "Title": "Beckman K. Challenge to the Insurance Industry: A Solution to Significantly Reduce Health Care Costs. Cut Health Care Costs. July 2016.",
      "Url": "http://www.cuthealthcarecosts.org/ChallengetotheInsuranceIndustry.pdf"
    },
    {
      "Title": "Kaiser Permanente. SCPMG Regional Health Education 15116 (3/2019).",
      "Url": "https://1w7lsd145y0x22fgi71wekk2-wpengine.netdna-ssl.com/wp-content/uploads/15116-plant-based-eating.pdf"
    },
    {
      "Title": "Kaiser Permanente. SCPMG Regional Health Education MH1537 (8/2013).",
      "Url": "https://thrive.kaiserpermanente.org/care-near-you/northern-california/santarosa/wp-content/uploads/sites/15/2015/09/New-Plant-Based-Booklet-1214_tcm28-781815.pdf"
    },
    {
      "Title": "Szucs TD, Stoffel AW. Nutrition and health—Why payors should get involved. Nutrition. 2016;32(5):615-6.",
      "Url": "https://pubmed.ncbi.nlm.nih.gov/26796149/"
    }
  ],
  "Acknowledgements": "Motion graphics by Avo Media",
  "Topics": [
    {
      "Title": "blood pressure",
      "Url": "https://nutritionfacts.org/topics/blood-pressure/"
    },
    {
      "Title": "cardiovascular disease",
      "Url": "https://nutritionfacts.org/topics/cardiovascular-disease/"
    },
    {
      "Title": "chronic diseases",
      "Url": "https://nutritionfacts.org/topics/chronic-diseases/"
    },
    {
      "Title": "diabetes",
      "Url": "https://nutritionfacts.org/topics/diabetes/"
    },
    {
      "Title": "heart disease",
      "Url": "https://nutritionfacts.org/topics/heart-disease/"
    },
    {
      "Title": "heart health",
      "Url": "https://nutritionfacts.org/topics/heart-health/"
    },
    {
      "Title": "high blood pressure",
      "Url": "https://nutritionfacts.org/topics/high-blood-pressure/"
    },
    {
      "Title": "hypertension",
      "Url": "https://nutritionfacts.org/topics/hypertension/"
    },
    {
      "Title": "industry influence",
      "Url": "https://nutritionfacts.org/topics/industry-influence/"
    },
    {
      "Title": "medical profession",
      "Url": "https://nutritionfacts.org/topics/medical-profession/"
    },
    {
      "Title": "Plant-Based Diets",
      "Url": "https://nutritionfacts.org/topics/plant-based-diets/"
    },
    {
      "Title": "vegans",
      "Url": "https://nutritionfacts.org/topics/vegans/"
    },
    {
      "Title": "vegetarians",
      "Url": "https://nutritionfacts.org/topics/vegetarians/"
    }
  ],
  "DoctorsNote": {
    "Html": "<p>For more on treating the underlying cause of lifestyle diseases, see:</p>\n<ul>\n<li><a href=\"https://nutritionfacts.org/video/lifestyle-medicine-treating-the-causes-of-disease/\">Lifestyle Medicine: Treating the Causes of Disease</a></li>\n<li><a href=\"https://nutritionfacts.org/video/convincing-doctors-to-embrace-lifestyle-medicine/\">Convincing Doctors to Embrace Lifestyle Medicine</a></li>\n<li><a href=\"https://nutritionfacts.org/video/what-diet-should-physicians-recommend/\">What Diet Should Physicians Recommend?</a></li>\n<li><a href=\"https://nutritionfacts.org/video/the-actual-benefit-of-diet-vs-drugs/\">The Actual Benefit of Diet vs. Drugs</a></li>\n</ul>\n<p>For health in the workplace, check out <a href=\"https://nutritionfacts.org/video/a-workplace-wellness-program-that-works/\">A Workplace Wellness Program That Works</a></p>\n     <p>If you haven&#39;t yet, you can <a href=\"https://nutritionfacts.org/subscribe/\" title=\"Subscribe\">subscribe to our free newsletter</a>. With your subscription, you&#39;ll also get notifications for just-released blogs and videos. Check out our <a href=\"https://nutritionfacts.org/translations-info/\" target=\"_blank\" title=\"Translated Resources\">information page</a> about our translated resources.</p>"
  }
}
