{
  "Title": "Diet vs. Exercise for Weight Loss",
  "Url": "https://nutritionfacts.org/video/diet-or-exercise-whats-more-important-for-weight-loss/",
  "YouTubeVideo": {
    "Url": "https://www.youtube.com/embed/LFa0t2X0hMk"
  },
  "UpdatedAt": "2012-09-03T10:59:14+00:00",
  "Author": "Michael Greger M.D. FACLM",
  "Volume": {
    "Title": "Volume 10",
    "Url": "https://nutritionfacts.org/volumes/volume-10/"
  },
  "License": {
    "Name": "Creative Commons Attribution-NonCommercial 4.0 International (CC BY-NC 4.0)",
    "Url": "https://creativecommons.org/licenses/by-nc/4.0/"
  },
  "Description": "When asked whether food and beverage consumption, or physical activity, was more important, the majority of people get the answer wrong.",
  "Transcript": "When trying to lose weight, which is most important: diet or exercise? This is what a survey found recently: “The vast majority of those trying to lose or maintain weight believe that both monitoring food and beverage consumption and physical activity are equally important in weight maintenance and weight loss.” Most people go with equally important, and then exercise, and then diet. And, most people are wrong.\nIdentified as one of the most common misconceptions about obesity in this recent review, the “Confusion about the leverage of exercise on body weight.” “Unfortunately, the energy balance equation [you know, calories in have to equal calories out] suggests that energy intake and energy expenditure occupy equivalent roles in determining energy balance, when in fact the factors governing energy intakes influence the energy balance far more powerfully than the factors determining resting energy expenditure.” \nWhat we put in our mouths is most important. For example, to walk off the calories found in single pat of butter, you’d have to add an extra 700 yards to your stroll that evening. A quarter-mile jog for each sardine we put in our mouth—and that’s just the edible part. And those who choose to eat two chicken legs better get out on their own two legs, and run an extra three miles that day to outrun weight gain. And that’s for steamed chicken; skin removed.\nTo see any graphs, charts, graphics, images, and quotes to which Dr. Greger may be referring watch the above video. This is just an approximation of the audio contributed by Kerry Skinner.\nPlease consider volunteering to help out on the site.",
  "Sources": [
    {
      "Title": "Ding EL, Hu FB. Commentary: Relative importance of diet vs physical activity for health. Int J Epidemiol. 2010 Feb;39(1):209-11; author reply 213-4.",
      "Url": "http://ije.oxfordjournals.org/content/39/1/209.full.pdf+html"
    },
    {
      "Title": "Flatt JP. Issues and misconceptions about obesity. Obesity (Silver Spring). 2011 Apr;19(4):676-86.",
      "Url": "http://onlinelibrary.wiley.com/doi/10.1038/oby.2011.7/abstract"
    },
    {
      "Title": "International Food Information Council Foundation. 2011. Food & Health Survey: Consumer Attitudes Toward Food Safety, Nutrition & Health.",
      "Url": "http://www.foodinsight.org/Content/3840/2011%20IFIC%20FDTN%20Food%20and%20Health%20Survey.pdf"
    }
  ],
  "Acknowledgements": "Images thanks to Evan-Amos via Wikimedia Commons; Mike Baird via flickr; NOAA; and Luan",
  "Topics": [
    {
      "Title": "body fat",
      "Url": "https://nutritionfacts.org/topics/body-fat/"
    },
    {
      "Title": "butter",
      "Url": "https://nutritionfacts.org/topics/butter/"
    },
    {
      "Title": "calories",
      "Url": "https://nutritionfacts.org/topics/calories/"
    },
    {
      "Title": "chicken",
      "Url": "https://nutritionfacts.org/topics/chicken/"
    },
    {
      "Title": "exercise",
      "Url": "https://nutritionfacts.org/topics/exercise/"
    },
    {
      "Title": "obesity",
      "Url": "https://nutritionfacts.org/topics/obesity/"
    },
    {
      "Title": "poultry",
      "Url": "https://nutritionfacts.org/topics/poultry/"
    },
    {
      "Title": "sardines",
      "Url": "https://nutritionfacts.org/topics/sardines/"
    },
    {
      "Title": "weight loss",
      "Url": "https://nutritionfacts.org/topics/weight-loss/"
    }
  ],
  "DoctorsNote": {
    "Html": "<p class=\"p1\"><span class=\"s1\">This will look familiar to those who’ve seen my 2012 presentation (either live or vicariously at <a href=\"https://nutritionfacts.org/video/uprooting-the-leading-causes-of-death/\"><span class=\"s2\">Uprooting the Leading Causes of Death</span></a>). Tomorrow I cover the wild finding about meat’s affect on weight in <a href=\"https://nutritionfacts.org/video/meat-and-weight-gain-in-the-panacea-study/\"><span class=\"s2\">Meat and Weight Gain in the PANACEA Study</span></a>. Note the caloric expenditure equivalencies I present here are assuming no dietary compensation, something seen quite dramatically, for example, in nut consumption in <a href=\"https://nutritionfacts.org/video/testing-the-dietary-compensation-theory/\"><span class=\"s2\">Testing the Dietary Compensation Theory</span></a>. Given how hard it is to work off food, let’s make our calories count by choosing the most nutrient dense foods. <a href=\"https://nutritionfacts.org/video/calculate-your-healthy-eating-score/\"><span class=\"s2\">Calculate Your Healthy Eating Score</span></a> may be a good place to start.</span></p>\n<p class=\"p2\"><span class=\"s3\">For further context, check out my associated blog posts: <a href=\"https://nutritionfacts.org/blog/treadmill-desks-stand-up-for-health/\"><span class=\"s2\">Treadmill Desks: Stand Up For Health</span></a>; <a href=\"https://nutritionfacts.org/2013/11/26/best-nutrition-bang-for-your-buck/\"><span class=\"s2\">Best Nutrition Bang for Your Buck</span></a>; and <a href=\"https://nutritionfacts.org/2013/01/17/diet-vs-exercise-whats-more-important/\"><span class=\"s2\">Diet vs. Exercise: What’s More Important?</span></a></span></p>\n<p>For more on diet and exercise, see: </p>\n<ul>\n<li><a href=\"https://nutritionfacts.org/video/how-much-exercise-to-sustain-weight-loss/\">How Much Exercise to Sustain Weight Loss</a></li>\n<li><a href=\"https://nutritionfacts.org/video/the-role-of-diet-vs-exercise-in-the-obesity-epidemic/\">The Role of Diet vs. Exercise in the Obesity Epidemic</a></li>\n<li><a href=\"https://nutritionfacts.org/video/is-swimming-good-for-weight-loss/\">Is Swimming Good for Weight Loss?</a></li>\n<li><a href=\"https://nutritionfacts.org/video/the-best-time-to-exercise-for-weight-loss/\">The Best Time to Exercise for Weight Loss</a></li>\n<li><a href=\"https://nutritionfacts.org/video/better-to-exercise-before-or-after-meals-for-weight-loss-and-blood-sugar-control/\">Better to Exercise Before or After Meals for Weight Loss and Blood Sugar Control?</a></li>\n</ul>\n     <p>If you haven&#39;t yet, you can <a href=\"https://nutritionfacts.org/subscribe/\" title=\"Subscribe\">subscribe to our free newsletter</a>. With your subscription, you&#39;ll also get notifications for just-released blogs and videos. Check out our <a href=\"https://nutritionfacts.org/translations-info/\" target=\"_blank\" title=\"Translated Resources\">information page</a> about our translated resources.</p>"
  }
}
